{
  "schema_version": "evidence-finalization-receipt.v1",
  "receipt_id": "RECEIPT_P5_SYNTHETIC_001",
  "receipt_hash": "22e2243f8250c198333215c9c554ece42032d31821b9fd35e174728711919560",
  "operation_type": "BATCH_MERGE",
  "operation_key": "evidence.batch.merge:CASE_P5_SYNTHETIC_1:1:cd6153b05b81e9362cced88872f596bea0cf8e456889cb27bb34fce290be04e3:2",
  "request_hash": "c6294c8c3f6cfbdcf6c9cd5f7a97d9dc70a585cf204cad0f4d9be23a3212364e",
  "result_hash": "cd8c0057e57d872a60a8ce053a9e4ec29f92b0255a278349352442284690ff5e",
  "commit_scope": "ISOLATED_SYNTHETIC_LEDGER",
  "status": "COMMITTED",
  "formal_domain_write": false,
  "formal_sink_eligible": false,
  "tenant_surrogate": "TENANT_P5_SYNTHETIC_1",
  "case_id": "CASE_P5_SYNTHETIC_1",
  "room_epoch": 1,
  "fencing_token": 7,
  "source_revision": 3,
  "process_revision": 4,
  "room_revision": 6,
  "operation_binding": {
    "manifest_hash": "cd6153b05b81e9362cced88872f596bea0cf8e456889cb27bb34fce290be04e3",
    "dossier_target_version": 2,
    "proposal_hash": "3648869670940a1475f743cce003faa1389f8fb376cbc8e4078bc2dc76a00d72",
    "logical_run_id": "RUN_P5_ONE",
    "command_id": "COMMAND_P5_ONE",
    "attempt_id": "ATTEMPT_P5_ONE_1",
    "thread_id": "grt.v1.018f6b7ec30a7430982fffc520c8195c"
  },
  "merge_count": 0,
  "domain_event_ids": [],
  "outbox_ids": [],
  "hearing_opened": false,
  "committed_at": "2026-07-22T12:06:00Z"
}
